Login reusit cu user laurica,1620245354864
Nota obtinută de studentul BOBla materia Istoriea fost agaugata cu succes în catalog,1620245359526
Afisarea notelor studentului BOB a fost incheiata cu succes,1620245359534
Afisarea notelor studentilor grupei grupa252 la materia Matematica a fost incheiata cu succes,1620245359534
Afisarea studentilor din grupa grupa252 a fost incheiata cu succes,1620245359535
Afisarea materiilor grupei grupa252 a fost incheiata cu succes,1620245359535
Delogare reusita pentru user laurica,1620245359535
